<?xml version="1.0" encoding="UTF-8"?>
<!DOCTYPE employes SYSTEM "employes.dtd">
<employes>
  <employee>
    <identity>
      <name>Sarah Johnson</name>
      <birthday>
        <date>
          <day>15</day>
          <month>03</month>
          <year>1990</year>
        </date>
      </birthday>
      <hiring_date>
        <date>
          <day>10</day>
          <month>01</month>
          <year>2020</year>
        </date>
      </hiring_date>
    </identity>
    <departement>
      <dept_name>Engineering</dept_name>
    </departement>
    <contact>
      <email>sarah.johnson@company.com</email>
      <address>123 Main Street, New York, NY 10001</address>
    </contact>
    <role>
      <job_title>Senior Software Engineer</job_title>
      <job_description>Develops and maintains core application features, leads technical design discussions</job_description>
    </role>
  </employee>
  
  <employee>
    <identity>
      <name>Michael Chen</name>
      <birthday>
        <date>
          <day>22</day>
          <month>07</month>
          <year>1985</year>
        </date>
      </birthday>
      <hiring_date>
        <date>
          <day>05</day>
          <month>06</month>
          <year>2018</year>
        </date>
      </hiring_date>
    </identity>
    <departement>
      <dept_name>Marketing</dept_name>
    </departement>
    <contact>
      <email>michael.chen@company.com</email>
      <address>456 Oak Avenue, San Francisco, CA 94102</address>
    </contact>
    <role>
      <job_title>Marketing Manager</job_title>
      <job_description>Manages marketing campaigns, analyzes market trends, coordinates with sales team</job_description>
    </role>
  </employee>
  
  <employee>
    <identity>
      <name>Emily Rodriguez</name>
      <birthday>
        <date>
          <day>08</day>
          <month>11</month>
          <year>1992</year>
        </date>
      </birthday>
      <hiring_date>
        <date>
          <day>15</day>
          <month>09</month>
          <year>2021</year>
        </date>
      </hiring_date>
    </identity>
    <departement>
      <dept_name>Human Resources</dept_name>
    </departement>
    <contact>
      <email>emily.rodriguez@company.com</email>
      <address>789 Pine Road, Austin, TX 78701</address>
    </contact>
    <role>
      <job_title>HR Specialist</job_title>
      <job_description>Handles recruitment, employee relations, and benefits administration</job_description>
    </role>
  </employee>
  
  <employee>
    <identity>
      <name>David Williams</name>
      <birthday>
        <date>
          <day>30</day>
          <month>05</month>
          <year>1988</year>
        </date>
      </birthday>
      <hiring_date>
        <date>
          <day>01</day>
          <month>03</month>
          <year>2019</year>
        </date>
      </hiring_date>
    </identity>
    <departement>
      <dept_name>Finance</dept_name>
    </departement>
    <contact>
      <email>david.williams@company.com</email>
      <address>321 Elm Street, Chicago, IL 60601</address>
    </contact>
    <role>
      <job_title>Financial Analyst</job_title>
      <job_description>Analyzes financial data, prepares reports, assists with budget planning</job_description>
    </role>
  </employee>
  
  <employee>
    <identity>
      <name>Lisa Anderson</name>
      <birthday>
        <date>
          <day>12</day>
          <month>09</month>
          <year>1995</year>
        </date>
      </birthday>
      <hiring_date>
        <date>
          <day>20</day>
          <month>08</month>
          <year>2022</year>
        </date>
      </hiring_date>
    </identity>
    <departement>
      <dept_name>Engineering</dept_name>
    </departement>
    <contact>
      <email>lisa.anderson@company.com</email>
      <address>654 Maple Drive, Seattle, WA 98101</address>
    </contact>
    <role>
      <job_title>Junior Developer</job_title>
      <job_description>Implements features, fixes bugs, participates in code reviews</job_description>
    </role>
  </employee>
</employes>